compound	sentence	expected_order	image1_name	image1_caption	image2_name	image2_caption	image3_name	image3_caption	image4_name	image4_caption	image5_name	image5_caption
brass ring	A composite gaming chip which includes a strong frame made of a brass ring with axial protrusions and a central aperature with notches.	['96956947028.png', '80706529304.png', '95672336968.png', '65189326623.png', '51003386336.png']	51003386336.png	The image depicts a single pencil with an orange wooden body and a black eraser cap at the top. The pencil is oriented diagonally, with the point of the pencil touching the bottom left corner of the image and the eraser cap pointing upwards towards the top right corner. The pencil appears to be well-lit, with a smooth and shiny surface that reflects light, indicating it might be new or well-maintained. The background is plain white, which helps to highlight the pencil as the main subject of the image.	65189326623.png	The image depicts three cartoon-style children running on a track, each wearing orange and black athletic uniforms with numbers on their shirts. The child in the foreground is wearing the number 18 and appears to be crossing the finish line, indicated by an orange and white striped ribbon. The child in the middle is wearing the number 15, and the child in the background is wearing the number 13. All three children are smiling and seem to be enjoying the race. The background is plain white, emphasizing the focus on the children and their activity.	80706529304.png	The image depicts an intricately designed ring with a unique and elaborate appearance. The ring features a large, central gemstone that is oval-shaped and black in color. Surrounding the central stone is a halo of smaller, round orange gemstones, which add a striking contrast to the black center. The band of the ring is adorned with a series of small, evenly spaced white gemstones, possibly diamonds or another type of clear gemstone.\n\nOn either side of the central stone, there are decorative elements that resemble crowns or tiaras. These crowns are detailed with intricate designs, including small spikes and what appear to be small orange gemstones integrated into the design. The crowns are positioned symmetrically on either side of the central stone, adding a regal and majestic touch to the overall design.\n\nAdditionally, there is a small butterfly perched on top of the ring, near the central stone. The butterfly is detailed with wings that have a gradient of colors, transitioning from a darker shade at the top to a lighter shade at the bottom, giving it a realistic appearance. The butterfly's presence adds a whimsical and delicate element to the ring's design.\n\nThe ring itself appears to be made of a shiny, reflective metal, likely gold or a gold-plated material, given its polished look. The combination of the black central stone, the orange accents, and the white gemstones creates a visually striking and elegant piece of jewelry.\n\nOverall, the ring exudes a sense of luxury and sophistication, with its combination of bold and delicate elements. The use of contrasting colors and intricate details makes it a standout piece that would likely appeal to those who appreciate both classic and avant-garde jewelry designs.	95672336968.png	The image depicts an athlete in a crouched position, ready to sprint or jump. The athlete is wearing a white tank top with orange accents and black shorts. The shoes are black with orange and yellow details. The background is plain white, and the athlete is positioned on a narrow orange platform. The overall scene suggests a moment of concentration and preparation for athletic activity.	96956947028.png	The image depicts a ring with a unique and intricate design. The ring features a combination of materials and colors, creating a visually striking appearance. The outer band of the ring is made of a dark material, possibly black or dark brown, with a textured surface that gives it a rugged and durable look. This outer band is bordered by a thin, metallic-looking strip that adds a touch of elegance and contrast to the overall design.\n\nIn the center of the ring, there is a horizontal stripe that runs parallel to the outer band. This stripe is made of a lighter material, likely gold or another metallic color, which stands out against the darker outer band. The stripe has a brushed finish, giving it a slightly worn and rustic appearance, which complements the rugged texture of the outer band.\n\nThe inner part of the ring is also made of a dark material, similar to the outer band, but with a smooth finish that contrasts with the textured outer surface. The inner band appears to be polished, reflecting light and adding a subtle shine to the ring's interior.\n\nThe ring is positioned on a plain white background, which helps to highlight its intricate design and the interplay of colors and textures. The lighting in the image is soft, casting gentle shadows that accentuate the depth and dimensionality of the ring's design.\n\nOverall, the ring combines elements of ruggedness and elegance, making it a distinctive piece of jewelry that could appeal to those who appreciate both durability and style.
apples and oranges	Another one of us asked parents to cut up different types of apples and oranges, taste them, talk about their differences and go through a range of other experiences.	['34972099351.png', '06670601370.png', '06706738051.png', '47167686168.png', '78981196177.png']	06670601370.png	The image depicts a half-sliced orange with a green leaf attached to the stem. The orange is cut in such a way that it shows the juicy interior with segments clearly visible. The skin of the orange appears textured and slightly rough, while the flesh inside is bright orange and segmented into sections. The leaf on the stem is green and has a glossy appearance. The background is plain white, which makes the orange stand out prominently.	06706738051.png	The image depicts a row of six cartoon-style animals, arranged in a horizontal line against a plain white background. From left to right:\n\n1. The first animal is a white cat with orange ears and a small tuft of orange fur on its tail.\n2. The second animal is an orange cat with white markings on its face and paws.\n3. The third animal is a small black dog with large blue eyes and a red collar.\n4. The fourth animal is a black and white dog with a brown nose and a red collar.\n5. The fifth animal is a white dog with black spots on its face and a brown nose, also wearing a red collar.\n6. The sixth animal is a black dog with a brown nose and a red collar.\n\nAll the animals appear to be sitting or crouching, facing forward, and have a friendly and approachable demeanor. They are all adorned with red collars, which adds a touch of color to their otherwise monochromatic fur. The overall style of the image is cute and whimsical, making it suitable for children's illustrations or pet-themed designs.	34972099351.png	The image depicts a simple yet vibrant illustration of two red apples and two oranges. The apples are positioned on the left side, with one apple slightly behind the other, both displaying a glossy texture and small white specks that suggest a natural, fresh appearance. The apples have green stems and leaves attached to them.\n\nOn the right side of the image, there are two oranges. One orange is whole, while the other is sliced in half, revealing its juicy interior with segments clearly visible. The oranges have a bright, vibrant color, indicating their freshness and ripeness. Each orange has a green stem at the top, adding to the realistic portrayal of these fruits.\n\nThe background of the image is plain white, which helps to highlight the colors and details of the fruits. The overall composition is balanced, with the apples and oranges evenly distributed across the frame. The illustration style is clean and modern, with smooth lines and a focus on the natural beauty of the fruits.	47167686168.png	The image depicts two cartoon characters, each engaged in different activities. \n\nOn the left side of the image, a character is standing on a large rock or boulder. This character is holding a pickaxe and appears to be digging or chiseling into the rock. The character has brown hair and is wearing an orange shirt with rolled-up sleeves, brown pants, and black shoes.\n\nOn the right side of the image, another character is standing on a small stool. This character is holding a light bulb above their head, seemingly excited or proud. The character also has brown hair and is wearing a plaid shirt with rolled-up sleeves, dark pants, and black shoes. The light bulb they are holding is yellow with a glowing effect, indicating it is turned on.\n\nThe background of the image is plain white, which helps to emphasize the characters and their actions. The overall scene suggests themes of hard work, determination, and the discovery of new ideas or solutions.	78981196177.png	The image depicts a glass bowl filled with a layered dessert. The layers visible in the bowl include:\n\n1. **Bottom Layer**: A dark brown layer, likely a chocolate or coffee-based component.\n2. **Middle Layer**: A light orange layer, possibly a caramel or custard.\n3. **Top Layer**: A white layer, which appears to be whipped cream.\n\nOn top of the whipped cream, there are several fresh strawberries arranged in a circular pattern. Additionally, there are small chocolate chips sprinkled over the whipped cream and strawberries. The overall presentation is visually appealing and suggests a rich, indulgent dessert.
ghost town	Our wanderings had led us perilously close to the walls of the ghost town where restless spirits haunted the streets, eager to absorb the vitatlity of the living.	['77229322693.png', '08510094453.png', '95676628446.png', '81343436490.png', '96149834283.png']	08510094453.png	The image depicts a whimsical, cartoon-style character dressed as a ghost. The ghost is white with a friendly expression, featuring large, round eyes and a small, smiling mouth. It has a flowing white cape that billows behind it as it walks on a path covered with fallen orange leaves. The background shows an autumnal scene with trees and bushes in shades of orange and brown, and more leaves falling around the character. The overall atmosphere is playful and festive, likely representing Halloween or a similar holiday theme.	77229322693.png	"The image depicts a whimsical, Halloween-themed street scene. The setting appears to be a quaint, narrow urban street lined with colorful buildings and shops. The architecture of the buildings is reminiscent of traditional European styles, featuring steeply pitched roofs, dormer windows, and ornate facades.\n\nOn the left side of the street, there is a building with a bright orange awning that extends over its entrance. This building has large windows and a sign that reads ""134."" Below the awning, there is a small shop or restaurant with a warm, inviting atmosphere. The street itself is paved and clean, with a smooth surface that reflects the light from the street lamps.\n\nSeveral ghostly figures are scattered throughout the scene, adding a playful and spooky element to the otherwise ordinary street. These ghosts are white and have simple, rounded shapes with black eyes and mouths. They appear to be walking along the sidewalk, creating a sense of movement and activity.\n\nOn the right side of the street, there are more buildings with similar architectural features. These buildings also have colorful facades and signs, contributing to the vibrant and lively atmosphere of the street. Street lamps with ornate designs line the sidewalk, casting a soft glow over the area. The sky above is clear and bright, suggesting it is daytime.\n\nOverall, the image combines elements of everyday urban life with a festive, Halloween twist, creating a charming and imaginative scene. The presence of the ghosts adds a touch of whimsy and fun, making the street appear both familiar and magical."	81343436490.png	"The image depicts a classic Western town scene, characterized by its rustic and rugged atmosphere. The foreground features a dirt road that stretches into the distance, flanked by wooden buildings with weathered exteriors. These buildings have a worn, aged appearance, typical of old Western towns.\n\nOn the left side of the image, there is a prominent building with a wooden balcony and a sign that reads ""WANTED"" in bold letters. Below this sign, there is another sign that appears to be a menu or advertisement for a saloon or restaurant. The building has a lantern hanging from the balcony, adding to the vintage feel.\n\nTo the right of this building, there is a tall cactus plant, which is a common feature in Western desert landscapes. Further down the street, more buildings can be seen, each with unique architectural details such as balconies, signs, and windows. The buildings are constructed from wood, with some having a more weathered look than others.\n\nIn the background, there are large rock formations that resemble sandstone cliffs, typical of the American Southwest. These formations add to the dramatic and rugged setting of the town.\n\nOverall, the image captures the essence of a classic Western town, complete with its distinctive architecture, signage, and natural elements. The scene evokes a sense of history and adventure, reminiscent of the Wild West era."	95676628446.png	The image depicts an office setting at night, with a large window showing a starry sky outside. The room is dimly lit, creating a serene and somewhat mysterious atmosphere. \n\n**Objects in the Image:**\n\n1. **Desk**: The central object in the image is a wooden desk with a dark finish. The desk has multiple drawers on both sides, with the left side having three drawers stacked vertically and the right side having two drawers stacked vertically.\n\n2. **Chair**: Positioned in front of the desk is a modern office chair. The chair has a high backrest and is upholstered in a dark fabric. A brown jacket is draped over the back of the chair, suggesting someone might have recently been working there or is about to return.\n\n3. **Papers and Stationery**: On the desk, there are several items indicating active use. There are papers scattered across the surface, some of which appear to be documents or notes. A pen and a calculator are also visible, along with a small stack of books or binders. \n\n4. **Pens and Pencils**: There are multiple pens and pencils arranged in a container on the left side of the desk. Another container holds additional writing instruments.\n\n5. **Calculator**: A calculator is placed near the center of the desk, indicating that numerical calculations might be part of the work done here.\n\n6. **Posters or Papers**: There is a piece of paper or poster pinned to the wall above the desk, though the content is not legible from the image.\n\n7. **Window**: The large window behind the desk provides a view of the night sky filled with stars. This adds a sense of tranquility and isolation to the scene.\n\n8. **Flooring**: The floor appears to be tiled, reflecting the light from the desk area, which enhances the overall ambiance of the room.\n\n**Analysis and Description:**\n\nThis image captures a typical office environment during nighttime, emphasizing the solitude and focus often associated with late-night work. The presence of the starry sky outside the window suggests that the office is located in a high-rise building or a place with a clear view of the night sky. The dim lighting inside contrasts with the brightness of the night, highlighting the quiet and possibly contemplative nature of the space.\n\nThe scattered papers and writing instruments indicate ongoing work, perhaps research or administrative tasks. The presence of a calculator suggests that financial or quantitative analysis might be part of the job. The jacket draped over the chair implies	96149834283.png	The image depicts a vibrant and lush garden scene with various elements that contribute to its overall charm and beauty. Here is a detailed description of the image:\n\n1. **Vegetable Garden Bed**:\n   - The foreground prominently features a well-maintained vegetable garden bed.\n   - The garden bed is filled with a variety of vegetables, including:\n     - **Pumpkins**: There are two large pumpkins placed near the center of the garden bed.\n     - **Garlic**: Several heads of garlic are visible, scattered around the garden bed.\n     - **Leafy Greens**: Various leafy greens, such as lettuce or spinach, are growing in the garden bed.\n     - **Flowers**: There are also flowers interspersed among the vegetables, adding color and diversity to the garden.\n\n2. **Flower Garden**:\n   - Adjacent to the vegetable garden bed, there is a flower garden.\n   - The flower garden is filled with a variety of flowers, including:\n     - **Daisies**: Numerous daisies are blooming, showcasing their bright yellow petals.\n     - **Marigolds**: Marigolds with orange and red petals are also present, contributing to the garden's colorful palette.\n     - **Other Flowers**: There are other types of flowers, but they are not as clearly identifiable due to the dense arrangement.\n\n3. **Trees and Fencing**:\n   - Two trees are situated on either side of the garden, providing shade and a natural backdrop.\n   - A wooden fence runs along the perimeter of the garden, separating it from the rest of the landscape.\n   - The fence is simple and rustic, made of wooden planks.\n\n4. **House**:\n   - In the background, there is a small house with a red roof.\n   - The house appears to be a quaint, single-story structure, likely a country home.\n   - The house is partially obscured by the trees and the fence, giving it a secluded and peaceful appearance.\n\n5. **Landscape**:\n   - The ground surrounding the garden is covered in green grass, indicating a well-maintained lawn.\n   - The overall landscape is serene and inviting, suggesting a rural or suburban setting.\n\n6. **Sky**:\n   - The sky above is clear and white, indicating a bright and sunny day.\n   - The lighting in the image suggests that it is daytime, possibly late morning or early afternoon.\n\n### Analysis and Description\n\nThis image captures a
copy cat	The playful kitten, a miniature copy cat, mimicked the yoga poses of its human owner, its tiny paws mirroring the intricate movements.	['76230045663.png', '39497588644.png', '24801323866.png', '82991780025.png', '82047847966.png']	24801323866.png	The image features two animated characters standing side by side against a white background. Both characters have their arms crossed and are wearing casual outfits.\n\n1. **Character on the Left:**\n   - **Hair:** Blonde, long, and straight.\n   - **Hat:** Orange, wide-brimmed hat with an orange band.\n   - **Top:** Black sleeveless top.\n   - **Bottoms:** Dark pants with a belt.\n\n2. **Character on the Right:**\n   - **Hair:** Dark brown, long, and straight.\n   - **Hat:** Black, wide-brimmed hat with an orange band.\n   - **Top:** Red sleeveless top.\n   - **Bottoms:** Dark pants with a belt.\n\nBoth characters have large, expressive eyes and are smiling, giving them a friendly and approachable appearance. The hats they wear add a touch of style to their outfits.	39497588644.png	The image depicts a small, orange tabby kitten sitting on a black office chair. The kitten has a fluffy coat with distinct stripes and is looking to the side with a curious expression. The chair has a high backrest and a cushioned seat, both of which appear to be made of a smooth material. The background is plain and grid-like, suggesting that the image might have been digitally created or edited.	76230045663.png	The image depicts two cute, cartoon-style kittens with orange fur and white faces. They have large, expressive green eyes and small pink noses. The kittens are sitting side by side, facing each other, with their heads turned slightly towards the viewer. Their fluffy fur and detailed features give them a very adorable and endearing appearance. The background is plain white, which helps to highlight the kittens' vibrant colors and details.	82047847966.png	The image depicts a vintage typewriter with a bright orange body and black accents. The typewriter has a standard QWERTY keyboard layout, with keys arranged in rows. The keys are light brown with black lettering. The typewriter's carriage is visible at the top, holding a blank sheet of paper. The hands of a person are shown typing on the keyboard, with one hand pressing keys and the other hand holding the pen to write. The overall design suggests a classic, manual typewriter used for writing documents manually before the advent of modern computers.	82991780025.png	The image depicts two cartoon characters standing side by side, facing each other. Both characters are wearing matching black dresses adorned with orange and red floral patterns. The character on the left has blonde hair and is pointing at the character on the right with her index finger. The character on the right has dark hair and is also pointing at the other character with her index finger. Both characters appear to be in an animated conversation or argument, as indicated by their expressive faces and gestures. The background is plain white, which helps to emphasize the characters and their interaction.
