compound	sentence	expected_order	image1_name	image1_caption	image2_name	image2_caption	image3_name	image3_caption	image4_name	image4_caption	image5_name	image5_caption
love triangle	At the craft fair, the artist sold pendants shaped like a love triangle, with each side adorned with intricate heart patterns.	['70080592856.png', '16857080306.png', '66352366466.png', '59548334929.png', '56377316808.png']	16857080306.png	The image depicts a set of billiard balls arranged in a triangular rack, commonly used for starting a game of pool. The rack is black and holds 15 billiard balls, which are arranged in a specific pattern to ensure an even distribution of colors and numbers.\n\nHere is a detailed description of the objects present in the image:\n\n1. **Billiard Balls**: There are 15 billiard balls in total, each with a unique color and number. The balls are arranged in a triangular formation, which is typical for setting up a game of pool.\n   - **Color Distribution**:\n     - **Orange**: There are three orange balls.\n     - **White**: There are four white balls.\n     - **Black**: There are two black balls.\n     - **Red**: There are two red balls.\n     - **Brown**: There are two brown balls.\n     - **Yellow**: There is one yellow ball.\n     - **Green**: There is one green ball.\n     - **Blue**: There is one blue ball.\n     - **Pink**: There is one pink ball.\n     - **Cyan**: There is one cyan ball.\n     - **Purple**: There is one purple ball.\n     - **Gray**: There is one gray ball.\n     - **Beige**: There is one beige ball.\n     - **Light Orange**: There is one light orange ball.\n     - **Light Yellow**: There is one light yellow ball.\n     - **Light Blue**: There is one light blue ball.\n     - **Light Green**: There is one light green ball.\n     - **Light Pink**: There is one light pink ball.\n     - **Light Purple**: There is one light purple ball.\n     - **Light Gray**: There is one light gray ball.\n     - **Light Beige**: There is one light beige ball.\n     - **Light Light Orange**: There is one light light orange ball.\n     - **Light Light Yellow**: There is one light light yellow ball.\n     - **Light Light Blue**: There is one light light blue ball.\n     - **Light Light Green**: There is one light light green ball.\n     - **Light Light Pink**: There is one light light pink ball.\n     - **Light Light Purple**: There is one light light purple ball.\n     - **Light Light Gray**: There is one light light gray ball.\n     - **Light Light Beige**: There is one light light beige ball.\n     - **Light Light Light Orange**: There	56377316808.png	The image depicts two women engaged in a professional meeting or interview setting. They are seated across from each other at a table, which is positioned centrally between them. Both women are dressed in business attire, indicating a formal or professional context.\n\nThe woman on the left has curly hair and is wearing an orange blazer over a white blouse, paired with black pants and black high heels. She is holding a pen and appears to be writing or signing a document placed on the table in front of her. Her expression suggests she is focused and engaged in the conversation.\n\nThe woman on the right has straight, dark hair and is dressed in a black blazer over a white blouse, also paired with black pants and black high heels. She is gesturing with her right hand, possibly explaining something or making a point during the discussion. Her facial expression indicates that she is speaking or presenting information.\n\nBoth women are seated on office chairs with wheels, suggesting they are in an office environment. The chairs have armrests and are positioned on a light-colored floor. The table they are sitting around is rectangular and made of wood, with a simple design that does not distract from the professional nature of the scene.\n\nThe overall setting and attire of the individuals suggest a business meeting, job interview, or some form of professional consultation. The expressions and body language of both women indicate a positive and collaborative interaction, emphasizing the importance of communication and engagement in professional settings.	59548334929.png	The image depicts three cartoon characters standing in a line against a plain background. The character on the left is a man with short hair, wearing an orange sleeveless shirt over a white undershirt and black pants. He has his arms crossed and appears to be listening intently.\n\nThe character in the middle is a woman with long hair styled in a bun, wearing a light-colored top and black pants. She has her hands raised slightly, as if she is explaining something or making a point.\n\nThe character on the right is another man with short hair, wearing an orange button-up shirt over a white undershirt and black pants. He is holding a small object in his hand, possibly a ring or a box, and appears to be presenting it to the woman in the middle.\n\nThe overall scene suggests a conversation or interaction between the three characters, with the central woman possibly discussing something important or making a significant announcement.	66352366466.png	"The image depicts two individuals standing side by side, facing away from the viewer and looking towards a large, vibrant sunset in the background. The sky is painted with warm hues of orange and yellow, transitioning to a lighter shade as it moves upward. The sun is positioned near the horizon, casting a soft glow over the scene.\n\nThe individuals appear to be holding hands, suggesting a sense of companionship or intimacy. They are dressed casually; one person is wearing a short-sleeved orange top and black pants, while the other is dressed in a similar fashion with a short-sleeved brown top and black shorts. Both are wearing dark shoes.\n\nIn the foreground, there is a small patch of grass and wildflowers, including a few red flowers and green foliage. The ground appears to be a mix of dirt and grass, indicating an outdoor setting, possibly a beach or a park near a body of water. The overall atmosphere of the image is serene and peaceful, evoking feelings of tranquility and connection with nature."	70080592856.png	The image depicts a visually striking and symmetrical arrangement of numerous heart shapes, creating a pyramid-like structure. The hearts are arranged in a tiered fashion, with each layer containing more hearts than the one below it, culminating in a single heart at the apex. The hearts vary in size, with the largest ones forming the base and the smallest ones at the top.\n\nThe hearts are predominantly red and pink, with shades ranging from deep red to light pink, giving the structure a gradient effect. The hearts appear to be three-dimensional, with subtle shadows and highlights that enhance their depth and give them a glossy appearance. This gives the entire structure a vibrant and lively look.\n\nAt the base of the pyramid, there is a shadow cast on the surface, indicating that the hearts are placed on a flat plane. The background is plain white, which makes the colors of the hearts stand out even more vividly. There are also a few scattered hearts floating around the main structure, adding to the overall aesthetic appeal.\n\nThis image could be interpreted as a symbol of love or affection, often associated with Valentine's Day or romantic themes. The use of hearts, which are universally recognized symbols of love, enhances this interpretation. The pyramid shape might also suggest growth, accumulation, or building something significant over time.\n\nIn summary, the image is a visually appealing arrangement of heart shapes forming a pyramid, with a gradient of colors from deep red to light pink, set against a plain white background. The hearts have a glossy, three-dimensional appearance, and the overall composition suggests themes related to love and affection.
black box	The unit is encased in an attractive anodized black box that provides EMI/RFI shielding and allows for secure mounting with its threaded inserts on the bottom of its chassis.	['41077897719.png', '60904898706.png', '76956198734.png', '82295944756.png', '73920583487.png']	41077897719.png	The image depicts a black rectangular box with a lid, placed on a round wooden table. The box has a small orange ribbon or tag attached to the front, which is likely used for sealing or decorative purposes. The background is plain and white, which helps to highlight the box and the table. The overall setting appears minimalistic and clean.	60904898706.png	The image depicts an open cardboard box. The box is made of brown corrugated cardboard, which is commonly used for packaging and shipping items. The flaps of the box are spread out, revealing the interior of the box. The box has a rectangular shape with six sides: two longer sides, two shorter sides, and a top and bottom. \n\nOn the bottom side of the box, there is a barcode printed on it, which is typically used for scanning purposes in retail or logistics environments. The barcode consists of black bars and spaces arranged in a specific pattern that can be read by a barcode scanner.\n\nThe box appears to be empty and is placed against a plain white background, which helps to highlight its features and make it the focal point of the image. The overall appearance suggests that the box is ready for use, possibly for storing or transporting goods.	73920583487.png	The image depicts a cute, cartoon-style puppy with a friendly and cheerful expression. The puppy has a fluffy coat that is primarily brown with white markings on its face, chest, and paws. It has large, expressive black eyes and a small black nose. The puppy is wearing an orange collar around its neck. Its ears are floppy and dark brown, and it has a bushy tail. The puppy is sitting on a plain, light-colored background, which helps to highlight its adorable features.	76956198734.png	The image depicts a cartoon-style illustration of a computer workstation setup on a desk. The central element is a large monitor with a dark screen, displaying several small icons at the bottom. Below the monitor is a keyboard with a standard QWERTY layout and a numeric keypad on the right side. To the left of the keyboard, there is a cup holder containing various writing utensils such as pencils and pens. Next to the cup holder is a small figurine of a robot-like character with orange and white colors. On the right side of the keyboard, there is a mug with a handle, filled with a beverage that has a frothy top. Additionally, there is a small brown object resembling a mouse or a similar device placed near the mug. The overall scene suggests a creative or casual workspace with various items for writing, drinking, and possibly gaming or working.	82295944756.png	The image depicts a cartoon-style scene featuring a person wearing an orange hard hat, standing next to a conveyor belt. The conveyor belt is filled with red apples, and there is a machine on the right side of the image that appears to be sorting or processing the apples. The machine has a robotic arm with a striped pattern, which is interacting with one of the apples. The background is plain, focusing attention on the main elements of the scene.
hen party	In the barnyard, the hens gathered for their early morning hen party, pecking at the scattered feed and clucking excitedly.	['64751387734.png', '14218153967.png', '16686328418.png', '77119535961.png', '37074365923.png']	14218153967.png	The image depicts a cartoon-style black chicken standing on a small patch of dirt surrounded by grass and flowers. The chicken has a bright orange comb and wattle, and its eyes are wide open, giving it an expressive and curious appearance. The background is plain white, which makes the colorful chicken stand out prominently. The chicken's feet are yellow, and it appears to be looking down at something on the ground.	16686328418.png	The image depicts four women sitting around a table, each holding a burger. They appear to be enjoying their meal and are smiling. The table is red and has a tray with several burgers on it. The women are dressed in formal attire, with two wearing black dresses and the other two in light-colored dresses. The chairs they are sitting on are red and white. The overall scene suggests a casual dining experience among friends or colleagues.	37074365923.png	The image depicts four female runners in mid-stride, captured in a dynamic and energetic pose. Each runner is depicted with exaggerated, cartoon-like features, emphasizing their athletic build and movement. The runners are dressed in colorful athletic attire, which includes tank tops and shorts, and they are wearing running shoes suitable for track or road racing.\n\n1. **Runner on the Left**:\n   - **Attire**: Wearing a green tank top with black shorts.\n   - **Pose**: The runner has a focused expression, with her arms bent at the elbows and her legs extended forward, indicating active running motion.\n\n2. **Runner in the Middle Left**:\n   - **Attire**: Dressed in an orange tank top and black shorts.\n   - **Pose**: This runner also appears to be in mid-stride, with her arms and legs positioned similarly to the first runner, suggesting a synchronized pace.\n\n3. **Runner in the Middle Right**:\n   - **Attire**: Wearing a white tank top with a pink stripe and black shorts.\n   - **Pose**: This runner has a slightly different posture, with her arms more relaxed and her legs positioned differently, indicating a varied running style within the group.\n\n4. **Runner on the Right**:\n   - **Attire**: Dressed in a red tank top and black shorts.\n   - **Pose**: The runner on the far right is depicted with a similar level of energy and focus as the others, with her arms and legs in motion, suggesting she is actively participating in the race.\n\nThe runners are set against a plain background, which helps to emphasize their figures and the action taking place. The overall composition of the image conveys a sense of competition and athleticism, capturing the essence of a running event or race.	64751387734.png	The image depicts a whimsical scene featuring four cartoonish birds standing in front of a wooden birdhouse. The birdhouse is brown with a red roof and an orange flag on top. Each bird is wearing a colorful party hat with a striped pattern and a pom-pom at the end. The birds appear to be cheerful and are positioned in a line, facing the birdhouse. The background is plain white, emphasizing the vibrant colors of the birds and the birdhouse. The overall atmosphere of the image is playful and festive.	77119535961.png	The image depicts four cartoon-style women standing side by side, each holding a cocktail drink. They are dressed in brown dresses with orange sashes tied around their waists. The women appear to be smiling and enjoying themselves, suggesting a festive or celebratory occasion. Each woman is holding a different type of cocktail, with various garnishes and colors, indicating a variety of drinks being served at the event. The background is plain white, which helps to focus attention on the characters and their drinks.
pins and needles	I did a sweep for stray pins and needles and packaged up the tissue paper pattern pieces, folding along my muslin adjustments with them.	['18951355308.png', '31343098424.png', '69262707128.png', '24771463968.png', '62351469038.png']	18951355308.png	The image depicts a large pile of knitting needles scattered in various orientations. The needles come in different colors, including shades of black, gray, and brown, with some needles having orange tips. The needles appear to be made of metal or plastic and are arranged in a somewhat chaotic manner, creating a sense of disarray. The background is plain white, which contrasts with the needles, making them stand out prominently.	24771463968.png	The image depicts a person's foot and lower leg, with a hand holding the ankle area. The foot is bare, and the hand appears to be applying pressure or support to the ankle. The background is plain white, which helps to focus attention on the subject of the image.	31343098424.png	The image depicts a collection of screws and bolts in an orange plastic container. The screws come in various sizes and types, including Phillips head screws with black and orange heads, and some with hexagonal heads. The container is open, allowing the contents to be visible. The background is plain white, which makes the colorful screws stand out prominently.	62351469038.png	The image depicts a cylindrical container, likely made of plastic, with a black cap and a transparent body. The container appears to be filled with a liquid substance, which is partially visible through the clear section. The top part of the container has an orange label or band, while the rest of the body is white. The container is positioned against a plain white background, emphasizing its design and features.	69262707128.png	The image depicts a cartoon character with short, dark hair. The character is wearing a black shirt and has a white bandage wrapped around their head, covering their eyes. The bandage appears to be made of gauze or similar material. The character's face is partially visible, showing a small portion of their nose and mouth. The overall style of the image is simple and cartoonish.
bun in the oven	Popping a stale bun in the oven for a few minutes will let you make tasty lunches for an extra day or two.	['68092803556.png', '69447699784.png', '50796495623.png', '24126898562.png', '64309391652.png']	24126898562.png	The image depicts a person wearing traditional attire, specifically a black abaya with intricate lace detailing on the sleeves. The individual is also wearing a hijab that covers their head and extends down to their shoulders. The person is holding their pregnant belly with both hands, indicating they are expecting a child. The background of the image is plain white, which helps to highlight the subject in the foreground.	50796495623.png	The image depicts a cartoon-style illustration of a woman pushing a baby in a stroller. The woman is wearing a brown headscarf, a brown coat with a pocket on the left side, and brown pants. She also has a pair of brown shoes with orange details. The baby in the stroller is wearing a brown hat and an orange outfit. The stroller itself has a black frame with large wheels and an orange canopy. The background is plain white, which helps to highlight the subjects in the image.	64309391652.png	The image depicts a cartoon character of a person wearing a hijab and a white garment. The character is holding a tissue to their nose, suggesting they might be sneezing or blowing their nose. The background is plain white, which helps to focus attention on the character.	68092803556.png	The image depicts a loaf of bread with a golden-brown crust, placed on a wooden cutting board. The bread appears to be freshly baked, as indicated by its slightly puffed and airy texture. The top of the loaf is sprinkled with sesame seeds, adding a touch of texture and flavor. The bread has been sliced into two pieces, revealing a soft, porous interior with a honeycomb-like pattern of air pockets. Scattered around the cutting board are a few sesame seeds, suggesting they were used as a topping during the baking process. The overall presentation is clean and appetizing, highlighting the bread's fresh and wholesome appearance.	69447699784.png	The image depicts a loaf of bread with a golden-brown crust, placed on a wooden cutting board. The bread appears to be freshly baked, as indicated by its slightly puffed and airy texture. The top of the loaf is sprinkled with sesame seeds, adding a touch of texture and flavor. The bread has been sliced into two pieces, revealing a soft, porous interior with a honeycomb-like pattern of air pockets. Scattered around the cutting board are a few sesame seeds, suggesting they were used as a topping during the baking process. The overall presentation is clean and appetizing, highlighting the bread's fresh and wholesome appearance.
loan shark	Our mermaid heroine visits a loan shark which offers her the shells she needs in exchange for repayment and a favor once she becomes queen.	['57469910132.png', '91154880140.png', '36582309103.png', '72575235835.png', '32211216966.png']	32211216966.png	The image depicts a firefighter in full gear, including an orange fire-resistant suit with reflective stripes, a helmet with a visor, and a large air tank attached to the back. The firefighter is equipped with various safety and rescue equipment, such as gloves, boots, and a harness. The overall appearance suggests readiness for firefighting operations.	36582309103.png	The image depicts a classical architectural structure, likely a government building or courthouse, characterized by its grand and imposing design. The building features a symmetrical facade with a central entrance flanked by two sets of columns. Each column is topped with a capital, and the entablature above the columns includes a pediment with a clock at its center.\n\nThe building has three stories, with the ground floor featuring a large central door flanked by two smaller windows on either side. Above the door, there is a triangular pediment supported by the columns. The second and third floors each have two windows, with the second floor windows being slightly larger than those on the third floor. The windows on both floors are framed with decorative railings.\n\nThe building's exterior walls are constructed from a reddish-brown material, possibly stone or brick, giving it a sturdy and historical appearance. The roof is flat and extends slightly beyond the walls, adding to the grandeur of the structure. The steps leading up to the entrance are made of dark stone, contrasting with the lighter color of the building itself.\n\nOverall, the image presents a detailed and realistic depiction of a classical government building, emphasizing its architectural elegance and historical significance.	57469910132.png	The image depicts a cartoonish, anthropomorphic shark character dressed in a formal business suit. The shark has a large, open mouth with sharp teeth, and its body is adorned with a dark suit, white shirt, and an orange tie. The character has one fin on each side of its head and is standing with hands on hips, exuding a confident and assertive demeanor. The overall style is whimsical and playful, blending the natural form of a shark with human-like characteristics.	72575235835.png	The image depicts two cartoon-style characters dressed in business attire, exchanging money. The character on the left is handing over a stack of dollar bills to the character on the right, who is receiving them with a smile. Both characters are wearing suits, ties, and formal shoes, indicating a professional setting. The background is plain white, which helps to focus attention on the interaction between the two characters.	91154880140.png	The image depicts a cartoon fish character dressed in a formal business suit. The fish has a large, round head with prominent, expressive eyes and a small mouth. Its body is covered in orange scales, and it has a brown tail fin. The fish is wearing a black pinstripe suit, a white dress shirt, and a red tie. The overall appearance gives the impression of a sophisticated, professional fish character.
