compound	sentence	expected_order	image1_name	image1_caption	image2_name	image2_caption	image3_name	image3_caption	image4_name	image4_caption	image5_name	image5_caption
green fingers	The toddler ran in and proudly held up a picture of a tree as her green fingers threatened to smear paint on the kitchen walls and cupboards.	['38213294711.png', '92628846416.png', '88406435457.png', '10027562830.png', '88683770392.png']	10027562830.png	The image depicts an elderly man engaged in gardening activities. He is crouching down next to a small garden bed, which is enclosed by a wooden fence. The garden bed contains various plants and vegetables, including tomatoes, garlic, and what appears to be young seedlings or small plants. \n\nThe man is wearing a light-colored shirt, brown pants, and a wide-brimmed hat with a small orange decoration on the brim. He has a white beard and glasses, suggesting he might be older. His expression seems focused as he tends to the plants.\n\nIn the background, there is a tree with green leaves, providing some shade over the garden bed. The tree is situated behind the fence, adding a natural element to the scene. The ground around the garden bed is covered with dark soil, indicating that it is actively being cultivated.\n\nThere are several tomatoes visible in the garden bed, some of which are already fully grown while others are still small and green. Garlic bulbs are also present, identifiable by their distinct shape and size. Additionally, there are young seedlings or small plants emerging from the soil, showing signs of growth.\n\nThe overall scene conveys a sense of tranquility and diligence, highlighting the man's commitment to his gardening hobby. The presence of the fence suggests that the garden is well-maintained and possibly part of a larger garden or backyard area.\n\nThis detailed description should provide a comprehensive understanding of the image for any text-based model to answer related questions.	38213294711.png	The image depicts a cartoon-style illustration of a young girl with brown hair tied back in a ponytail. She is wearing overalls and has paint splatters on her hands, face, and clothing. The paint appears to be green and orange, suggesting she might have been involved in some form of creative activity or playtime. Her expression is cheerful and enthusiastic, with wide eyes and a big smile, indicating she is enjoying herself. The background is plain white, which helps to focus attention on the girl and her colorful paint splatters.	88406435457.png	The image depicts an elderly man with gray hair and a mustache, wearing a light-colored shirt and dark pants. He is standing next to a potted plant, which appears to be a small palm tree or similar type of plant. The man is holding a watering can in his right hand and a smaller container in his left hand. He is in the process of watering the plant, pouring water from the watering can onto the soil in the pot. The background is plain and white, focusing attention on the man and the plant. The overall scene suggests a nurturing activity, possibly related to gardening or plant care.	88683770392.png	The image depicts an elderly man playing the piano. He is seated on a black stool with orange accents, positioned in front of a large, dark-colored grand piano. The piano has a shiny, reflective surface and is placed on a raised platform. The man is dressed in a formal suit with a red tie, and he appears to be focused on playing the instrument. The background is plain white, which helps to emphasize the subject and the piano. The overall scene suggests a classical music performance or practice session.	92628846416.png	The image depicts a close-up of a human hand with the palm facing upwards and fingers slightly curled. The hand appears to be of a light skin tone, and it is holding a small object that is not visible in the image. The nails on the fingers are painted with a glossy, dark green nail polish. The lighting in the image is soft, creating subtle shadows and highlights on the hand, which gives it a realistic appearance. The background is plain and white, ensuring that the focus remains solely on the hand and its details. There are no other objects or elements present in the image.
ancient history	This course will suit anyone fascinated by Greece and Rome, who recognises the continuing influence of ancient history on the modern world.	['97760341223.png', '89162981347.png', '91744816929.png', '80235397834.png', '20677180119.png']	20677180119.png	"The image depicts an old, rusted car parked on a street. The car appears to be vintage, possibly from the mid-20th century, given its design and style. It has a two-tone color scheme with the front half painted in a dark color, likely black or dark gray, and the rear half in a lighter shade, possibly beige or light brown. The car\'s paint is heavily rusted, indicating it has been exposed to the elements for a long time.\n\nThe car\'s body shows significant wear and tear, with visible rust patches and dents. The rear bumper is particularly damaged, with parts of it missing and the remaining parts appearing to be held together by wires or straps. The license plate is also rusted and partially obscured, but the numbers ""3944C6"" can be discerned.\n\nThere is some greenery growing around the car, particularly on the right side where the car is parked. This suggests that the car has been abandoned for a considerable period, allowing nature to reclaim some of the space around it. There are also some small plants and grasses growing near the car, adding to the sense of decay and abandonment.\n\nIn the background, there is a tree with green leaves, indicating that the scene is set outdoors during a season when trees are in full leaf, such as spring or summer. The sky is not visible, but the lighting suggests it is daytime.\n\nThe street where the car is parked is paved and appears to be in decent condition, with no visible cracks or damage. There are a few small rocks scattered on the ground near the car, which might have been dislodged by the car\'s movement or weather conditions.\n\nOverall, the image conveys a sense of neglect and abandonment, highlighting the contrast between the once-functional vehicle and the natural processes of decay and growth."	80235397834.png	The image depicts a person standing in front of a framed painting. The painting features a stylized, somewhat abstract scene with a tree and two silhouetted figures holding hands. The tree has branches that extend outward, adorned with leaves that appear to be in shades of orange and red, suggesting an autumnal theme. Butterflies are also depicted flying around the tree, adding a whimsical touch to the artwork.\n\nThe person in the image is facing away from the viewer, looking at the painting. They have short, dark hair and are wearing a dark-colored shirt. The background of the painting is a mix of light and dark tones, creating a contrast that highlights the figures and the tree. The overall style of the painting is artistic and evocative, with a blend of natural elements and human interaction. The frame of the painting is ornate, adding to the aesthetic appeal of the piece.	89162981347.png	The image depicts a stylized, cartoonish desk calendar. The calendar is designed with a brown and black base, featuring a white page with a grid of dates. The dates are numbered from 1 to 31, indicating the days of the month. \n\nAt the top of the calendar, there is a spiral binding mechanism, suggesting that it can be flipped through like a book. The calendar page is decorated with small, whimsical illustrations of orange and yellow characters or objects, which appear to be playful and cheerful. These characters are positioned around the edges of the calendar page, adding a touch of fun and personality to the design.\n\nOn the right side of the calendar, there is a small cloud-like shape with a light blue gradient, possibly representing a thought bubble or an idea. This element adds a sense of creativity and imagination to the overall aesthetic of the calendar.\n\nThe calendar is placed on a black stand with four small legs, providing stability and a sturdy base for the calendar to sit on. The stand also has a slight curve at the front, giving it a modern and sleek appearance.\n\nOverall, the calendar combines functionality with a playful and imaginative design, making it suitable for both practical use and as a decorative item on a desk.	91744816929.png	The image depicts two individuals sitting on a wooden bench in what appears to be a park or garden setting during autumn. The bench is positioned in front of a tree with orange and red leaves, indicating the fall season. The tree has a slender trunk and branches extending outward, covered in vibrant foliage.\n\nSurrounding the bench, there is lush green grass and various plants, including small bushes and flowers. The ground around the bench is covered with fallen leaves, further emphasizing the autumn theme. A few butterflies can be seen flying around, adding a touch of liveliness to the scene.\n\nThe individuals are facing away from the viewer, sitting side by side on the bench. They appear to be engaged in conversation or simply enjoying the peaceful environment. The person on the left is wearing a brown shirt and dark pants, while the person on the right is dressed in a white shirt and light-colored pants. Both individuals have short hair and are standing upright, suggesting a relaxed posture.\n\nThe overall atmosphere of the image is serene and inviting, capturing a moment of tranquility and companionship amidst the beauty of nature. The use of warm colors for the leaves and butterflies enhances the autumnal ambiance, creating a visually appealing and harmonious composition.	97760341223.png	The image depicts a scene set in what appears to be an ancient Roman or Greek courtyard. The setting is characterized by several key elements:\n\n1. **Buildings and Structures**:\n   - **Foreground**: There is a large, two-story building with a red-tiled roof on the right side of the image. The building has a classical architectural style with columns supporting an overhanging roof.\n   - **Middle Ground**: A smaller building with a simpler design is visible in the background. This structure has a flat roof and appears to be made of stone.\n   - **Background**: Additional buildings can be seen, some of which have balconies and windows.\n\n2. **Pathway and Ground**:\n   - The ground is paved with large, irregularly shaped stones, giving it an ancient appearance.\n   - There are patches of grass and small plants growing through the cracks in the pavement.\n\n3. **People**:\n   - Three individuals are present in the image. Two of them are standing near the left side of the courtyard, dressed in traditional robes that resemble those worn during the Roman era. One of them is holding a shield, suggesting he might be a soldier or a guard.\n   - The third person is standing closer to the center-right of the image, also dressed in a robe and engaged in conversation with the other two individuals.\n\n4. **Furniture and Decorations**:\n   - There are several large pots and vases placed around the courtyard, adding to the classical aesthetic.\n   - A tree with green foliage stands prominently in the middle of the courtyard, providing shade and a touch of nature.\n\n5. **Additional Details**:\n   - The walls of the buildings show signs of wear and age, with some areas appearing cracked and peeling.\n   - There are various small plants and shrubs scattered throughout the courtyard, contributing to the overall greenery.\n\n### Analysis and Description\n\nThis image captures a serene and historical scene reminiscent of ancient Roman or Greek times. The architectural elements, such as the columns, the red-tiled roofs, and the stone-paved pathway, are indicative of classical architecture. The presence of individuals dressed in traditional robes and the use of shields suggest a military or protective context, possibly indicating a guard or soldiers stationed in the area.\n\nThe combination of natural elements like trees and plants with the man-made structures creates a balanced and harmonious environment. The scene likely represents a moment of daily life in a historical setting, where individuals interact within a structured and
devil's advocate	The manga follows Hinata, who gives up his job as the Devil's advocate and abandons the afterlife to pursue his dream of opening an American diner.	['45875492932.png', '77995675587.png', '86883605636.png', '95645261777.png', '11847407637.png']	11847407637.png	The image depicts a cartoon character of a woman dressed in a uniform. She has short brown hair styled in a ponytail and is wearing a white polo shirt with black trim around the collar and sleeves. The shirt features an orange logo on the left side of the chest. She is also wearing black pants with orange stripes running down the sides, black boots, and black shoes. The character has a confident stance with one hand on her hip.	45875492932.png	The image depicts a cartoon-style scene involving three characters in an office setting. \n\n1. **Character on the Left**: This character is a red devil with large horns, a small tail, and a menacing expression. The devil is standing with one hand on its hip, looking angry or frustrated.\n\n2. **Character in the Middle**: This character is a woman with blonde hair, wearing a black suit and a red tie. She is sitting behind a desk, with her arms crossed, appearing to be in a state of concern or frustration. There is a laptop on the desk in front of her.\n\n3. **Character on the Right**: This character is a man with dark hair, wearing a black suit and a red tie. He is seated in a chair, gesturing with his hands as if he is explaining something or making a point. His expression suggests he is trying to communicate effectively.\n\nThe overall scene seems to depict a tense or challenging conversation between these three characters, possibly in a professional or business context. The devil's presence adds a humorous or exaggerated element to the situation.	77995675587.png	The image depicts a cartoon scene involving three characters: a man in a striped shirt and black pants, a woman in a black suit, and a person sitting behind a desk. The man in the striped shirt is standing to the left of the desk, while the woman in the black suit is seated on the right side of the desk. The person sitting behind the desk appears to be a judge or an official, as indicated by the gavel on the desk. The setting suggests a formal or legal context, possibly a courtroom or an office environment.	86883605636.png	The image depicts two individuals engaged in what appears to be an interview or conversation. The person on the left is seated on a chair, wearing a bright orange blazer over a white shirt and black skirt, paired with black high heels. This individual has shoulder-length brown hair and is smiling, with their hands gesturing as if explaining something.\n\nThe person on the right stands holding a microphone, dressed in a dark suit with a white shirt and a yellow tie. They have short brown hair and are also smiling, looking towards the seated individual. The background is plain white, and both individuals are positioned on a gray platform, suggesting they might be on a stage or set designed for interviews or presentations.	95645261777.png	The image depicts four women standing in a line, each holding a piece of cardboard. They are dressed in matching outfits consisting of orange tops and black pants. The women appear to be engaged in a collaborative activity, possibly discussing or presenting something on the cardboard. The background is plain white, which helps to focus attention on the subjects.
piece of cake	He picked up the piece of cake and took a large bite, chewing noisily.	['78485019666.png', '04237996522.png', '55124577858.png', '96911519929.png', '84842839046.png']	04237996522.png	The image depicts a beautifully decorated cake. The cake has a white base with a chocolate drip effect running down its sides, giving it a rich and elegant appearance. The top of the cake is adorned with various decorative elements:\n\n1. **Whipped Cream**: There is a generous amount of whipped cream piped around the base of the cake, adding a fluffy and creamy texture.\n2. **Chocolate Decorations**: A large piece of chocolate is placed on top of the cake, possibly in the shape of a heart or a similar design, contributing to the overall aesthetic.\n3. **Fruit Toppings**: Several fresh strawberries are placed on top of the cake, along with a slice of orange. These fruits not only add a pop of color but also suggest a fruity flavor profile.\n4. **Heart-Shaped Decorations**: Small heart-shaped decorations are scattered around the top of the cake, adding a playful and festive touch.\n5. **Green Leaves**: A few green leaves are placed among the fruit toppings, providing a fresh contrast to the vibrant colors of the strawberries and orange.\n\nThe cake is presented on a dark brown plate, which complements the chocolate theme and enhances the visual appeal of the dessert. The overall presentation is meticulous and visually appealing, making it suitable for special occasions such as birthdays, anniversaries, or other celebrations.	55124577858.png	The image depicts a cartoon-style illustration of a person climbing a rock wall. The climber is wearing an orange shirt, brown pants, and black climbing shoes with crampons. They have a harness around their waist, equipped with various climbing gear such as carabiners and a chalk bag. The rock wall is grey with some orange holds for the climber to grip. The climber appears to be in the middle of an ascent, with one hand reaching up to grasp a hold while the other leg is raised to step up. The overall scene conveys the activity of rock climbing.	78485019666.png	The image depicts a slice of layered cake with a rich and visually appealing presentation. The cake is cut into a triangular shape, revealing its multi-layered structure. Here's a detailed description:\n\n1. **Base Layer**: The bottom layer appears to be a dense, chocolate-based crust or sponge cake. It has a dark brown color, indicating the presence of cocoa or chocolate.\n\n2. **Middle Layers**: Between the base and the top layers, there are two visible cream layers. These layers have a lighter, creamy color, suggesting they might be made from ingredients like cream cheese, buttercream, or a similar type of frosting. The layers are evenly spread and appear smooth, with small dots of orange zest or fruit pieces sprinkled on them, adding a pop of color and texture.\n\n3. **Top Layer**: The topmost layer consists of a thick, white cream or frosting. This layer is generously piped in a decorative manner, forming peaks and swirls. The cream is smooth and glossy, indicating it might be whipped cream or a similar airy mixture.\n\n4. **Decorations**: The cake is garnished with several elements:\n   - **Whipped Cream**: The peaks of whipped cream are prominently displayed, adding volume and a fluffy texture.\n   - **Orange Slices**: Two orange slices are placed on top of the whipped cream, providing a fresh and vibrant contrast to the white cream.\n   - **Chocolate Chips**: Small chocolate chips are scattered across the top layer, adding a touch of sweetness and a crunchy texture.\n   - **Candied Orange Peel**: There are small pieces of candied orange peel, which add a slight crunch and a burst of citrus flavor.\n\n5. **Additional Elements**: A few chocolate chips are scattered around the base of the cake slice, possibly as part of the decoration or to enhance the visual appeal.\n\nOverall, the cake slice is meticulously crafted, combining elements of chocolate, cream, and citrus to create a visually enticing and likely delicious dessert. The combination of textures??rom the dense chocolate crust to the creamy middle layers and the light whipped cream??uggests a harmonious blend of flavors and a satisfying eating experience.	84842839046.png	The image depicts a bowl of ramen, a popular Japanese noodle dish. The bowl is filled with a rich, orange-brown broth that appears to be the base of the ramen. The broth is garnished with various toppings, which include:\n\n1. **Noodles**: The noodles are thin and appear to be of the wheat variety, typical for ramen.\n2. **Green Onions (Scallions)**: Chopped green onions are scattered on top of the noodles, adding a fresh, green color contrast.\n3. **Boiled Egg**: A halved boiled egg with a soft-boiled yolk is placed in the center of the bowl.\n4. **Tofu Puffs**: Several pieces of light-colored tofu puffs are floating in the broth.\n5. **Marinated Meat**: There are chunks of marinated meat, possibly pork or beef, which are dark brown and appear tender.\n6. **Chili Pepper**: Slices of red chili pepper are placed on top, adding a spicy element to the dish.\n7. **Carrot Shreds**: Thinly sliced carrot shreds provide a vibrant orange color and a sweet flavor.\n8. **Mushrooms**: Small pieces of mushrooms are also present, adding a earthy taste.\n9. **Nori Sheets**: Small pieces of nori (seaweed) are scattered around the bowl, providing a slight crunch.\n\nThe bowl itself has a traditional design with red and white patterns along the rim. The overall presentation is colorful and appetizing, showcasing the diverse ingredients that make up a typical ramen dish.	96911519929.png	The image depicts a cartoon-style scene set in a golf course. The central figure is a young boy wearing a brown cap, an orange polo shirt, and white shorts with black shoes. He is standing on a well-maintained green grassy area, which appears to be a putting green. The boy is holding a golf ball in his right hand and seems to be preparing to make a putt.\n\nTo the left of the boy, there is a golf flagstick planted in the ground. The flag on the stick is orange, indicating that it is likely a hole marker or a flag used for marking the location of the hole. The flagstick is positioned upright, suggesting that the hole is ready for play.\n\nIn the background, there is a large tree with a thick trunk and a dense canopy of green leaves. The tree is situated slightly to the right of the boy, providing a natural element to the scene. The background also includes a few more trees and shrubs, contributing to the lush greenery of the golf course.\n\nThe sky above is clear with a light blue hue, indicating a bright and sunny day. There are no visible clouds, which suggests good weather conditions for playing golf. The overall setting is serene and picturesque, typical of a well-maintained golf course.\n\nThe grass on the putting green is meticulously cut and shows a pattern of parallel lines, which is characteristic of a professional golf course. The green is surrounded by more grassy areas, and the terrain appears to be gently sloping, which is common in golf courses to facilitate the movement of the golf ball.\n\nOverall, the image captures a peaceful moment on a golf course, with the boy seemingly enjoying his time playing golf under favorable weather conditions. The presence of the flagstick and the well-kept green suggest that the course is maintained for recreational or competitive play.
