compound	sentence	expected_order	image1_name	image1_caption	image2_name	image2_caption	image3_name	image3_caption	image4_name	image4_caption	image5_name	image5_caption
secret santa	St Nicholas becomes a secret santa in this fun adventure, going undercover to keep an eye on the elves in his workshop.	['43012219877.png', '53937857464.png', '73884284579.png', '43315095878.png', '83896740010.png']	43012219877.png	The image depicts a person dressed in a Santa Claus costume. The costume includes a red suit with white fur trim, a red hat with a white fur trim, and black gloves. The individual is holding a pair of black goggles or glasses up to their face, covering their eyes. The background is plain white, which makes the colorful and detailed Santa costume stand out prominently.	43315095878.png	The image depicts a group of four people, two men and two women, standing around a table filled with various gift boxes. The individuals appear to be engaged in an activity involving the exchange or presentation of gifts. \n\n- The man on the far left is wearing a dark suit and tie, holding a small box wrapped in brown paper.\n- The woman next to him is also dressed in a dark outfit and is holding a larger box wrapped in orange paper.\n- The man in the center is dressed in a dark suit and tie as well, and he is holding a card with a name on it, possibly indicating the recipient of the gift.\n- The woman on the far right is wearing a light-colored blouse and a dark skirt, and she is holding a box wrapped in red paper.\n\nThe table itself is rectangular and dark-colored, with several gift boxes placed on it. Each box has a name tag attached to it, suggesting that they are personalized gifts for specific individuals. The overall scene conveys a sense of celebration or a special occasion where gifts are being exchanged or presented.	53937857464.png	The image depicts a whimsical scene featuring Santa Claus in his workshop. Santa is standing behind a large wooden workbench filled with various tools and toys. He is holding a small, orange toy car in his hand. The workshop is adorned with snowflakes falling from the sky, adding to the festive atmosphere.\n\nOn the workbench, there are several items including:\n- A wooden shelf with various tools and objects.\n- A small wooden house with a chimney.\n- A snowman made of wood.\n- A red and white train.\n- A stack of wooden blocks.\n- A small wooden tree with colorful decorations.\n- A wooden birdhouse.\n- A collection of wooden spoons and other utensils.\n- A small wooden box with a lid.\n\nThe overall scene is vibrant and colorful, capturing the essence of Santa's workshop where he crafts and repairs toys for children around the world.	73884284579.png	The image depicts two cartoon characters standing side by side, exchanging a gift. The character on the left is a woman with dark hair, wearing a brown blouse and black pants, and brown shoes. She is holding a wrapped gift box with an orange ribbon in her hands. The character on the right is a man with a beard, wearing a brown shirt, black pants, and brown shoes. He is smiling and appears to be receiving the gift from the woman. The background is plain white, and there is a shadow beneath each character, indicating they are standing on a flat surface.	83896740010.png	The image depicts a round dining table set for a meal, surrounded by six chairs. The table is covered with a beige tablecloth and is adorned with various dishes, drinks, and utensils. Here is a detailed description of the objects present on the table:\n\n1. **Dishes and Food Items**:\n   - There are several plates of food arranged around the table. Each plate contains different types of food items, including what appears to be a variety of appetizers, main courses, and desserts.\n   - A large, round dish in the center of the table holds a pie or tart, which has a golden-brown crust and appears to be filled with a fruit filling.\n   - To the left of the pie, there is a smaller plate with a serving of what looks like a meat dish, possibly a steak or roast, garnished with herbs and served with a side of vegetables.\n   - Another plate to the right of the pie contains a serving of pasta or another type of noodle dish, topped with a creamy sauce and garnished with herbs.\n   - There are also smaller plates with various other dishes, including what might be a salad or a vegetable medley.\n\n2. **Drinks**:\n   - Several glasses of wine are placed around the table, some filled with red wine and others with white wine. The glasses are accompanied by wine bottles.\n   - There are also glasses of water and possibly some juice or soda, indicated by the presence of a pitcher or carafe.\n\n3. **Utensils and Serveware**:\n   - Utensils such as forks, knives, and spoons are placed next to each plate, indicating that the meal is ready to be eaten.\n   - There are also small bowls and cups, likely for condiments or sauces.\n\n4. **Decorative Elements**:\n   - A lit candle is placed on the table, adding a warm and inviting ambiance to the setting.\n   - A small vase with flowers is also present, contributing to the decorative aspect of the table.\n\n5. **Table Setting**:\n   - The table is set with place mats under each plate, ensuring cleanliness and organization.\n   - The chairs surrounding the table are dark-colored, providing a contrast to the lighter tablecloth.\n\n6. **Overall Atmosphere**:\n   - The overall atmosphere of the table setting suggests a formal or semi-formal dining experience, possibly for a special occasion or a family gathering.\n\n### Analysis and Description\n\nThis image represents
dirty word	They traced the letters onto the window in mud with their fingers, forming a dirty word which they hoped would lead the others to their location.	['36466202137.png', '24899523859.png', '06993539786.png', '44754936991.png', '14069763077.png']	06993539786.png	The image depicts a cartoon scene involving two characters: a young boy and an adult woman. The boy, who appears to be around 5-7 years old, is standing on the left side of the image. He has brown hair, wide eyes, and is wearing an orange shirt with dark pants and orange shoes. His hands are gesturing as if he is explaining something.\n\nThe adult woman, who seems to be in her late 20s or early 30s, is standing on the right side of the image. She has brown hair tied up in a bun and is wearing a black top and black pants. Her arms are crossed, and she appears to be listening intently to the boy.\n\nAbove the boy's head, there is a speech bubble containing an illustration of a television set. The television screen is glowing with a bright orange color, indicating that it is turned on. The overall scene suggests that the boy might be talking about watching television, and the woman is either concerned or curious about what he is saying.	14069763077.png	The image depicts two toothbrushes placed against a white background. The toothbrush on the left is black with white bristles and has a dollop of white toothpaste on its bristles. The toothbrush on the right is orange with white bristles and features a cartoonish face on its handle, which includes eyes, a mouth, and a small tuft of hair. Both toothbrushes have a similar design in terms of the bristle arrangement and overall shape, but they differ in color and the presence of the cartoon character on the handle of the right toothbrush.	24899523859.png	The image depicts a stack of various ceramic dishes and utensils, neatly arranged on three black trays. The dishes include plates, bowls, cups, and saucers, all of which appear to be made of white ceramic with some orange splatter designs. The arrangement is orderly, with the dishes stacked in a way that maximizes space efficiency. The overall appearance suggests a well-organized kitchen setup, possibly for display or storage purposes.	36466202137.png	"The image depicts a weathered and muddy road sign, which appears to be covered in dirt and grime. The sign is mounted on two sturdy posts that are also heavily soiled. The sign itself is rectangular with rounded corners and has a yellow background with black text. The text on the sign reads ""Nott Wam,"" which seems to be a combination of letters or words, possibly indicating a location or direction.\n\nThe sign is positioned on a patch of grass, which is partially submerged in water, suggesting recent rain or flooding. The surrounding area is muddy, with visible tracks and puddles, indicating that the ground is wet and slippery. The overall scene conveys a sense of neglect and abandonment, as the sign and its surroundings appear to have been left unattended for some time.\n\nThe background of the image is plain white, which helps to highlight the details of the sign and its immediate environment. The contrast between the bright yellow of the sign and the dark mud creates a striking visual effect. The grass around the sign is green and lush, providing a stark contrast to the otherwise dirty and worn appearance of the sign and posts.\n\nIn summary, the image shows a weathered and muddy road sign with the text ""Nott Wam,"" set against a backdrop of grass and water, alluding to a neglected and possibly abandoned area. The scene is characterized by the contrast between the bright yellow sign and the dark, muddy surroundings."	44754936991.png	"The image depicts two cartoon characters standing on a light gray background. The character on the left is a young boy with brown hair, wearing an orange striped shirt and black pants. He has his hands raised in a gesture that suggests surprise or confusion. Above his head, there is an orange speech bubble containing the text ""$88%!"" which appears to be a slang expression.\n\nThe character on the right is an adult male with dark hair, wearing a brown V-neck shirt and gray pants. He has his hands on his hips and is looking at the boy with a surprised or shocked expression. His eyes are wide open, and his mouth is slightly open as well.\n\nThe overall scene conveys a moment of surprise or shock between the two characters, with the boy seemingly reacting to something said by the adult male. The use of the ""$88%"" text in the speech bubble adds a humorous or exaggerated element to the scene."
close shave	This kind of close shave is optimal for many men, but for others can contribute to skin irritation or a propensity for ingrown hairs.	['61687169887.png', '36654367033.png', '15095694666.png', '55410405875.png', '89483662888.png']	15095694666.png	The image depicts a cartoon-style illustration of a young girl swinging on a large, netted hammock. She is wearing an orange top and black shorts, and her hair is flowing freely as she swings. The background features a clear blue sky with a few white clouds, and there are several orange butterflies flying around the hammock. The overall scene conveys a sense of joy and freedom.	36654367033.png	The image depicts a person holding an electric razor to their beard. The individual has short, dark hair and is wearing a black shirt. The electric razor is black with an orange handle.	55410405875.png	The image depicts a cartoon-style scene where a man is holding a smartphone and appears to be in shock or surprise. He is standing on a sidewalk next to a brick wall. A large, black object, which looks like a television set, is flying through the air and crashing into the wall, causing debris to scatter around. The man's expression and body language suggest that he is surprised by the sudden impact of the television. The overall scene conveys a sense of unexpected and dramatic action.	61687169887.png	The image depicts a stylized, cartoon-like character with a razor blade positioned near the chin, creating a dramatic effect as if the character is about to shave. The character has short, dark hair and is surrounded by a cloud of shaving foam, emphasizing the action of shaving. The background is plain white, which helps to highlight the character and the shaving foam.	89483662888.png	The image depicts two individuals dressed in traditional Indian bridal attire, facing each other. They are adorned with elaborate jewelry, including necklaces, earrings, nose rings, and bangles. Each person is wearing a saree, which is a long piece of fabric draped over the shoulder and wrapped around the waist. The sarees are decorated with intricate patterns and are complemented by floral garlands. The background is plain white, emphasizing the vibrant colors and details of their attire.
donkey work	We have the donkey work from the stable if it is raining because it is the only shelter we have.	['18787432584.png', '18911527144.png', '20662025964.png', '21236393136.png', '06637246420.png']	06637246420.png	The image depicts a goldfish with a vibrant orange and white coloration. The fish has a prominent red patch on its head, which is characteristic of certain goldfish breeds. Its body is covered in scales that reflect light, giving it a shiny appearance. The fins are large and flowing, with the tail fin being particularly elaborate and spread out. The fish appears to be swimming, with its mouth slightly open as if it is breathing or speaking. The background is plain white, which helps to highlight the fish's colors and details.	18787432584.png	The image depicts a cartoon donkey standing on a rocky surface. The donkey has a friendly and slightly surprised expression, with wide eyes and a small smile. It is heavily burdened with a large pile of goods strapped to its back. The goods include various items such as sacks, rocks, and what appears to be a large carrot. The donkey's harness and straps are visible, indicating that it is carrying the load. The overall scene suggests a humorous or exaggerated depiction of a donkey carrying an excessive amount of weight.	18911527144.png	The image depicts a donkey grazing on grass in a natural setting. The donkey has a brown coat with some lighter patches and is standing on a patch of dirt with sparse grass. The background is plain white, which helps to highlight the donkey and its surroundings. The donkey's head is lowered towards the ground, indicating it is eating the grass. The overall scene suggests a peaceful moment in a rural or semi-rural environment.	20662025964.png	The image depicts a person sitting at a desk, working on a computer. The individual is wearing an orange shirt and black pants, and is seated in a black office chair with armrests. The desk is wooden and has a black keyboard in front of the person. On the right side of the desk, there is a small potted plant with green leaves. The computer monitor displays a text-based interface with various windows open, suggesting that the person might be engaged in some form of digital work or study. The overall setting appears to be a typical home or office workspace.	21236393136.png	The image depicts a cartoon-style illustration of a person carrying a large, round bundle of hay on their back. The person is wearing a light-colored shirt, dark shorts, and dark shoes. The hay bundle appears to be quite heavy, as the person is struggling to hold it up. The background is plain white, which helps to emphasize the figure and the hay bundle. The overall scene suggests a rural or agricultural setting, possibly involving farm work.
top dog	The top dog in the neighborhood seemed to be guarding the alley from passing cats all day.	['62040589986.png', '43207170783.png', '38568900802.png', '76177115752.png', '44297130521.png']	38568900802.png	The image depicts a cartoon-style scene of a traffic officer directing traffic at an intersection. The officer is standing on a raised pedestrian crossing, wearing a black uniform with a star badge on the chest and a cap. The officer's right arm is extended, signaling vehicles to stop or proceed as needed.\n\nIn the background, there is a yellow taxi with its lights on, indicating it might be stopped or slowing down. The taxi is positioned on the left side of the image, facing towards the officer. The road is marked with white dashed lines, and there is a traffic cone placed near the officer, possibly to guide or direct traffic.\n\nTo the right of the officer, there is a pedestrian crossing sign with a symbol of a person walking, indicating that it is safe for pedestrians to cross. Behind the sign, there is a tree and some bushes, adding a touch of greenery to the scene. In the distance, there is a tall building visible, suggesting an urban setting.\n\nThe sky is clear with a few clouds, indicating good weather conditions. The overall scene conveys a sense of order and safety at the intersection, with the traffic officer ensuring smooth traffic flow and pedestrian safety.	43207170783.png	The image depicts a cartoon dog wearing an orange party hat with a pom-pom on top. The dog has a light brown coat, large brown eyes, and a black nose. It appears to be sitting and smiling, giving off a cheerful and festive vibe.	44297130521.png	The image depicts a cozy scene featuring a brick fireplace with a warm, glowing fire burning inside. The flames are bright and orange, casting a soft light around the hearth. In front of the fireplace, there is a cute, orange tabby cat with white paws and a white face, lying down and sleeping peacefully. The cat's eyes are closed, and it appears to be enjoying the warmth of the fire. To the left of the fireplace, there is a pine cone, adding to the rustic and homely atmosphere. The overall scene conveys a sense of comfort and relaxation, typical of a cold winter day by the fireplace.	62040589986.png	The image depicts three cartoon dogs stacked on top of each other, forming a pyramid-like structure. The dogs are illustrated in a cute and playful style.\n\n1. **Top Dog**: \n   - This dog is wearing an orange crown with a gold emblem at the center.\n   - It has brown fur with white accents around its eyes and ears.\n   - Its expression appears to be happy or content.\n\n2. **Middle Dog**:\n   - This dog is wearing a red collar with a gold emblem.\n   - It also has brown fur with white accents around its eyes and ears.\n   - Its expression is similar to the top dog, appearing happy or content.\n\n3. **Bottom Dog**:\n   - This dog is sitting on a large orange ball.\n   - It has black fur with white accents around its eyes and ears.\n   - Its expression is cheerful, with a slight smile.\n\nThe overall scene conveys a sense of balance and harmony, with each dog supporting the one above it. The use of bright colors and simple shapes makes the image visually appealing and engaging.	76177115752.png	The image depicts a business meeting scenario. There are three individuals seated around a rectangular conference table. The person on the right is wearing a dark suit with an orange tie and is gesturing with his left hand, possibly explaining something to the others. The two people on the left are dressed in similar dark suits and appear to be listening attentively. They each have a pen in their hands, suggesting they might be taking notes or preparing to do so. The setting appears to be a professional office environment, indicated by the modern office chairs and the formal attire of the individuals.
